{
  "boundDigests": {
    "comparisonPolicyDigest": "ca2ba7d352b351633ea8c4baf571a9af6c4205653371e2b5a1c393e6ba018557",
    "ledgerDigest": "9293409b73bc4f8c0b610608d71d738ba9efe60a1dac5f89a04ab4f1a115d5af",
    "policyDigest": "2f0e8c6b68c13be56b8a7ec2332402f4a3939368a162c31bde0fac3ef3ae7260",
    "taskDefinitionDigest": "d8238f22108e5f1d1e04a7f5d55061faf266e6455f625e4fe79ffda7c7ceebfd",
    "trialDigest": "7446e8c519b55575df0612d35dac5f1f91142663c1c6bfe65876b2fe532fb594"
  },
  "evidenceRowDigests": [
    "d1a4db564674c9f1ba32d08e48dbd13a25913a8d78802cb3de7c3c515dcb6995",
    "9292fcec1fbf3d2731876e10eec33b8982a03fa1b0db7cb1d4940539f58ad729",
    "5f2e364c884cdac530f6030df9a8ecf211c916a39578065ec08579036471df09",
    "124433c7b5561b30879b21b1b4d89877adf30da35ba236ac6158ecd33e2543a9",
    "5689f85dbb8f2559f7e933415804d8dd08bb6c8f072ac7c18e4cc5f7c44804e8"
  ],
  "failedGates": [
    "criticalRegressions"
  ],
  "lifecycleState": "ineligible",
  "participantIds": {
    "evaluators": [
      "portfolio-structural-fixture-evaluator-fixture-provider-confusion"
    ],
    "producers": [
      "portfolio-structural-fixture-producer-fixture-provider-confusion-combined",
      "portfolio-structural-fixture-producer-fixture-provider-confusion-guardrail",
      "portfolio-structural-fixture-producer-fixture-provider-confusion-method",
      "portfolio-structural-fixture-producer-fixture-provider-confusion-raw",
      "portfolio-structural-fixture-producer-fixture-provider-confusion-reviewer"
    ]
  },
  "profileDigest": "e4ae8ca6ba1f2d9b55c904d3d0bcb9303f23e1b4e577f40857163ab589d753e7",
  "profileIdentity": {
    "capabilityId": "eternities-aegis",
    "capabilityVersion": "06eac79d2408c457eaabb7cc766982aaba6836b75ec8c124630b94d119b9b5a9",
    "consequenceClass": "consequential",
    "environmentId": "4c4df503a614b013cddbc0523cee59ba709b3c6e656334e639bd8d50b6931baa",
    "modelFamily": "fixture-model-not-quality-evidence",
    "reasoningTier": "high",
    "taskClass": "security-review"
  },
  "profileKey": "9ba6a675677ddf073dcd6f90d9a7926b37515777b825c093140e1fce18e699fd",
  "promotableEvidenceRows": 4,
  "recommendedMode": "guardrail",
  "schemaVersion": 2,
  "variantMetrics": [
    {
      "criticalRegressions": 0,
      "evidenceLevels": [
        "model"
      ],
      "losses": 0,
      "matchedComparisons": 0,
      "maximumOverheadRatio": 1,
      "rowDigests": [
        "d1a4db564674c9f1ba32d08e48dbd13a25913a8d78802cb3de7c3c515dcb6995"
      ],
      "ties": 0,
      "variant": "raw",
      "wins": 0
    },
    {
      "criticalRegressions": 0,
      "evidenceLevels": [
        "model"
      ],
      "losses": 0,
      "matchedComparisons": 3000,
      "maximumOverheadRatio": 1.0009765625,
      "rowDigests": [
        "9292fcec1fbf3d2731876e10eec33b8982a03fa1b0db7cb1d4940539f58ad729"
      ],
      "ties": 0,
      "variant": "guardrail",
      "wins": 3000
    },
    {
      "criticalRegressions": 1,
      "evidenceLevels": [
        "model"
      ],
      "losses": 0,
      "matchedComparisons": 3000,
      "maximumOverheadRatio": 1.001953125,
      "rowDigests": [
        "5f2e364c884cdac530f6030df9a8ecf211c916a39578065ec08579036471df09"
      ],
      "ties": 0,
      "variant": "method",
      "wins": 3000
    },
    {
      "criticalRegressions": 0,
      "evidenceLevels": [
        "model"
      ],
      "losses": 0,
      "matchedComparisons": 3000,
      "maximumOverheadRatio": 1.0029296875,
      "rowDigests": [
        "124433c7b5561b30879b21b1b4d89877adf30da35ba236ac6158ecd33e2543a9"
      ],
      "ties": 3000,
      "variant": "reviewer",
      "wins": 0
    },
    {
      "criticalRegressions": 0,
      "evidenceLevels": [
        "model"
      ],
      "losses": 3000,
      "matchedComparisons": 3000,
      "maximumOverheadRatio": 1.00390625,
      "rowDigests": [
        "5689f85dbb8f2559f7e933415804d8dd08bb6c8f072ac7c18e4cc5f7c44804e8"
      ],
      "ties": 0,
      "variant": "combined",
      "wins": 0
    }
  ]
}
